ID,Name / Nom,Latitude,Longitude,Prov/Terr,Timezone / Fuseau horaire,wflow_code
04JC002,NAGAGAMI RIVER AT HIGHWAY NO. 11,49.77289,-84.53694,ON,UTC-05:00,4000654
04JD005,PAGWACHUAN RIVER AT HIGHWAY NO. 11,49.76419,-85.22619,ON,UTC-05:00,4000655
04JD006,KENOGAMISIS LAKE NEAR GERALDTON,49.69208,-86.88125,ON,UTC-05:00,4000656
04JF001,LITTLE CURRENT RIVER AT PERCY LAKE,50.66119,-86.53625,ON,UTC-05:00,4000657
04JG001,KENOGAMI RIVER NEAR MAMMAMATTAWA,50.42286,-84.38153,ON,UTC-05:00,4000658
04KA001,KWETABOHIGAN RIVER NEAR THE MOUTH,51.16083,-80.86394,ON,UTC-05:00,4000659
04LA002,MATTAGAMI RIVER NEAR TIMMINS,48.40431,-81.44836,ON,UTC-05:00,4000660
04LA003,TATACHIKAPIKA RIVER NEAR TIMMINS,48.32972,-81.58017,ON,UTC-05:00,4000661
04LA004,MOUNTJOY RIVER NEAR TIMMINS,48.34506,-81.33264,ON,UTC-05:00,4000662
04LA005,MINISINAKWA RIVER NEAR GOGAMA,47.71519,-81.61261,ON,UTC-05:00,4000663
04LA006,MOLLIE RIVER AT HIGHWAY NO. 144,47.49611,-81.84878,ON,UTC-05:00,4000664
04LB002,KAMISKOTIA RIVER ABOVE ENID CREEK,48.62664,-81.63033,ON,UTC-05:00,4000665
04LC002,IVANHOE LAKE NEAR FOLEYET,48.18275,-82.50111,ON,UTC-05:00,4000666
04LC003,IVANHOE RIVER AT FOLEYET,48.25021,-82.44381,ON,UTC-05:00,4000667
04LD001,GROUNDHOG RIVER AT FAUQUIER,49.31084,-82.04143,ON,UTC-05:00,4000668
04LE002,NEMEGOSENDA RIVER NEAR CHAPLEAU,47.93817,-83.06069,ON,UTC-05:00,4000669
04LF001,KAPUSKASING RIVER AT KAPUSKASING,49.41442,-82.43994,ON,UTC-05:00,4000670
04LG004,MOOSE RIVER ABOVE MOOSE RIVER,50.75158,-81.45139,ON,UTC-05:00,4000671
04LJ001,MISSINAIBI RIVER AT MATTICE,49.61108,-83.26778,ON,UTC-05:00,4000672
04LK001,MATTAWISHKWIA RIVER AT HEARST,49.68281,-83.6568,ON,UTC-05:00,4000673
04LM001,MISSINAIBI RIVER BELOW WABOOSE RIVER,50.58544,-82.091,ON,UTC-05:00,4000674
04MB002,DRIFTWOOD RIVER AT MONTEITH,48.64457,-80.67467,ON,UTC-05:00,4000675
04MB005,WATABEAG LAKE AT WATABEAG LAKE DAM,48.29289,-80.54489,ON,UTC-05:00,4000676
04MD005,PORCUPINE LAKE NEAR PORCUPINE,48.47781,-81.19044,ON,UTC-05:00,4000677
04ME003,ABITIBI RIVER AT ONAKAWANA,50.60292,-81.41464,ON,UTC-05:00,4000678
04MF001,NORTH FRENCH RIVER NEAR THE MOUTH,51.07672,-80.76408,ON,UTC-05:00,4000679
05AA004,PINCHER CREEK AT PINCHER CREEK,49.4864,-113.94769,AB,UTC-07:00,4000680
05AA008,CROWSNEST RIVER AT FRANK,49.59732,-114.41064,AB,UTC-07:00,4000681
05AA011,MILL CREEK NEAR THE MOUTH,49.46951,-114.13424,AB,UTC-07:00,4000682
05AA022,CASTLE RIVER NEAR BEAVER MINES,49.48866,-114.14438,AB,UTC-07:00,4000683
05AA024,OLDMAN RIVER NEAR BROCKET,49.55781,-113.82272,AB,UTC-07:00,4000684
05AA027,RACEHORSE CREEK NEAR THE MOUTH,49.83779,-114.42059,AB,UTC-07:00,4000685
05AA028,CASTLE RIVER AT RANGER STATION,49.39745,-114.3399,AB,UTC-07:00,4000686
05AA030,GOLD CREEK NEAR FRANK,49.60185,-114.40054,AB,UTC-07:00,4000687
05AA032,OLDMAN RESERVOIR NEAR PINCHER CREEK,49.61204,-114.05328,AB,UTC-07:00,4000688
05AA034,PINCHER CREEK AT FRONT RANGE ROAD,49.30934,-114.0751,AB,UTC-07:00,4000689
05AA035,OLDMAN RIVER AT RANGE ROAD NO. 13A,49.72769,-114.08649,AB,UTC-07:00,4000690
05AB005,TROUT CREEK NEAR GRANUM,49.97735,-113.68603,AB,UTC-07:00,4000691
05AB013,BEAVER CREEK NEAR BROCKET,49.63938,-113.7953,AB,UTC-07:00,4000692
05AB019,LETHBRIDGE NORTHERN IRRIGATION DISTRICT CANAL ABOVE OLDMAN FLUME,49.68706,-113.57692,AB,UTC-07:00,4000693
05AB021,WILLOW CREEK NEAR CLARESHOLM,50.01852,-113.71484,AB,UTC-07:00,4000694
05AB037,CHAIN LAKES RESERVOIR NEAR NANTON,50.20184,-114.19006,AB,UTC-07:00,4000695
05AB040,WILLOW CREEK AT SECONDARY NO. 532,50.24177,-114.35117,AB,UTC-07:00,4000696
05AB041,WILLOW CREEK AT OXLY RANCH,50.1291,-113.84663,AB,UTC-07:00,4000697
05AB042,PINE COULEE DIVERSION CANAL BELOW HEAD GATES,50.128,-113.78713,AB,UTC-07:00,4000698
05AB044,PINE COULEE RESERVOIR NEAR STAVELY,50.12167,-113.74902,AB,UTC-07:00,4000699
05AB045,PINE COULEE OUTFLOW BELOW RESERVOIR,50.12018,-113.75108,AB,UTC-07:00,4000700
05AC003,LITTLE BOW RIVER AT CARMANGAY,50.12765,-113.11819,AB,UTC-07:00,4000701
05AC012,LITTLE BOW RIVER BELOW TRAVERS DAM,50.1712,-112.72277,AB,UTC-07:00,4000702
05AC017,LOMOND LATERAL NEAR HEADGATE,50.21455,-112.66189,AB,UTC-07:00,4000703
05AC023,LITTLE BOW RIVER NEAR THE MOUTH,49.89987,-112.50553,AB,UTC-07:00,4000704
05AC031,MOSQUITO CREEK NEAR THE MOUTH,50.25185,-113.55414,AB,UTC-07:00,4000705
05AD003,WATERTON RIVER NEAR WATERTON PARK,49.11366,-113.8394,AB,UTC-07:00,4000706
05AD005,BELLY RIVER NEAR MOUNTAIN VIEW,49.0996,-113.69772,AB,UTC-07:00,4000707
05AD007,OLDMAN RIVER NEAR LETHBRIDGE,49.70942,-112.86288,AB,UTC-07:00,4000708
05AD010,DRYWOOD CREEK NEAR THE MOUTH,49.29441,-113.79424,AB,UTC-07:00,4000709
05AD013,UNITED IRRIGATION DISTRICT CANAL NEAR HILL SPRING,49.21804,-113.63324,AB,UTC-07:00,4000710
05AD017,MOUNTAIN VIEW IRRIGATION DISTRICT CANAL,49.07972,-113.68889,AB,UTC-07:00,4000711
05AD021,BELLY - ST. MARY DIVERSION CANAL,49.33607,-113.55406,AB,UTC-07:00,4000712
05AD025,WATERTON LAKE AT WATERTON PARK,49.0536,-113.90705,AB,UTC-07:00,4000713
05AD026,WATERTON RESERVOIR,49.32023,-113.68416,AB,UTC-07:00,4000714
05AD027,WATERTON - BELLY DIVERSION CANAL,49.32703,-113.63383,AB,UTC-07:00,4000715
05AD028,WATERTON RIVER NEAR GLENWOOD,49.43336,-113.48478,AB,UTC-07:00,4000716
05AD035,PRAIRIE BLOOD COULEE NEAR LETHBRIDGE,49.56628,-112.95427,AB,UTC-07:00,4000717
05AD037,PIYAMI DRAIN NEAR PICTURE BUTTE,49.83062,-112.76438,AB,UTC-07:00,4000718
05AD041,BELLY RIVER NEAR GLENWOOD,49.35212,-113.48044,AB,UTC-07:00,4000719
05AD042,YARROW CREEK AT SPREAD EAGLE ROAD,49.23194,-113.96078,AB,UTC-07:00,4000720
05AE002,LEE CREEK AT CARDSTON,49.19971,-113.29652,AB,UTC-07:00,4000721
05AE005,ROLPH CREEK NEAR KIMBALL,49.12501,-113.14256,AB,UTC-07:00,4000722
05AE006,ST. MARY RIVER NEAR LETHBRIDGE,49.57346,-112.84671,AB,UTC-07:00,4000723
05AE016,POTHOLE CREEK AT RUSSELL'S RANCH,49.56554,-112.82741,AB,UTC-07:00,4000724
05AE021,MAGRATH IRRIGATION DISTRICT CANAL NEAR SPRING COULEE,49.34839,-113.05515,AB,UTC-07:00,4000725
05AE025,ST. MARY RESERVOIR NEAR SPRING COULEE,49.36305,-113.11456,AB,UTC-07:00,4000726
05AE026,CANADIAN ST. MARY CANAL NEAR SPRING COULEE,49.34363,-113.04353,AB,UTC-07:00,4000727
05AF030,MILK RIVER RIDGE RESERVOIR,49.38129,-112.59025,AB,UTC-07:00,4000728
05AF034,MANYBERRIES CREEK AT HIGHWAY NO. 889,49.39369,-110.67849,AB,UTC-07:00,4000729
05AG003,EXPANSE COULEE NEAR THE MOUTH,49.98871,-112.08224,AB,UTC-07:00,4000730
05AG006,OLDMAN RIVER NEAR THE MOUTH,49.91889,-111.8,AB,UTC-07:00,4000731
05AH001,BOXELDER CREEK NEAR WALSH,49.96179,-109.98937,SK,UTC-07:00,4000732
05AH002,MACKAY CREEK AT WALSH,49.94091,-110.04722,AB,UTC-07:00,4000733
05AH005,SEVEN PERSONS CREEK AT MEDICINE HAT,50.02365,-110.68351,AB,UTC-07:00,4000734
05AH025,ELKWATER LAKE AT ELKWATER,49.66198,-110.28902,AB,UTC-07:00,4000735
05AH037,GROS VENTRE CREEK NEAR DUNMORE,49.88778,-110.50711,AB,UTC-07:00,4000736
05AH041,PEIGAN CREEK NEAR PAKOWKI ROAD,49.5805,-110.9437,AB,UTC-07:00,4000737
05AH047,SAM LAKE TRIBUTARY NEAR SCHULER,50.16348,-110.25759,AB,UTC-07:00,4000738
05AH048,CAVAN LAKE NEAR DUNMORE,49.94392,-110.40067,AB,UTC-07:00,4000739
05AH052,ROSS CREEK AT HIGHWAY NO. 41,50.00557,-110.53291,AB,UTC-07:00,4000740
05AH054,CYPRESS VIEW RESERVOIR NEAR ELKWATER,49.80078,-110.12886,AB,UTC-07:00,4000741
05AH055,MCALPINE CREEK RESERVOIR NEAR ELKWATER,49.70875,-110.16249,AB,UTC-07:00,4000742
05AH056,MACKAY CREEK RESERVOIR NEAR ELKWATER,49.71534,-110.12849,AB,UTC-07:00,4000743
05AH057,BULLSHEAD RESERVOIR NEAR ELKWATER,49.67757,-110.51437,AB,UTC-07:00,4000744
05AH058,SPRUCE COULEE RESERVOIR NEAR ELKWATER,49.67929,-110.18288,AB,UTC-07:00,4000745
05AJ001,SOUTH SASKATCHEWAN RIVER AT MEDICINE HAT,50.04209,-110.67754,AB,UTC-07:00,4000746
05BA001,BOW RIVER AT LAKE LOUISE,51.4286,-116.18894,AB,UTC-07:00,4000747
05BA002,PIPESTONE RIVER NEAR LAKE LOUISE,51.43311,-116.17495,AB,UTC-07:00,4000748
05BB001,BOW RIVER AT BANFF,51.17223,-115.57177,AB,UTC-07:00,4000749
05BC001,SPRAY RIVER AT BANFF,51.16018,-115.55447,AB,UTC-07:00,4000750
05BG006,WAIPAROUS CREEK NEAR THE MOUTH,51.28281,-114.83841,AB,UTC-07:00,4000751
05BG010,GHOST RIVER ABOVE WAIPAROUS CREEK,51.27003,-114.92553,AB,UTC-07:00,4000752
05BH004,BOW RIVER AT CALGARY,51.05027,-114.05146,AB,UTC-07:00,4000753
05BH005,BOW RIVER NEAR COCHRANE,51.17374,-114.46643,AB,UTC-07:00,4000754
05BH013,JUMPINGPOUND CREEK NEAR COX HILL,51.00233,-114.93814,AB,UTC-07:00,4000755
05BH014,NOSE CREEK ABOVE AIRDRIE,51.31191,-114.02759,AB,UTC-07:00,4000756
05BH015,JUMPINGPOUND CREEK AT TOWNSHIP ROAD NO. 252,51.12831,-114.5675,AB,UTC-07:00,4000757
05BH016,WEST NOSE CREEK AT CALGARY,51.19012,-114.14123,AB,UTC-07:00,4000758
05BJ001,ELBOW RIVER BELOW GLENMORE DAM,51.01279,-114.0932,AB,UTC-07:00,4000759
05BJ004,ELBOW RIVER AT BRAGG CREEK,50.94851,-114.56986,AB,UTC-07:00,4000760
05BJ010,ELBOW RIVER AT SARCEE BRIDGE,50.9935,-114.16989,AB,UTC-07:00,4000761
05BK001,FISH CREEK NEAR PRIDDIS,50.88547,-114.32684,AB,UTC-07:00,4000762
05BL004,HIGHWOOD RIVER BELOW LITTLE BOW CANAL,50.58563,-113.86936,AB,UTC-07:00,4000763
05BL007,STIMSON CREEK NEAR PEKISKO,50.43056,-114.16517,AB,UTC-07:00,4000764
05BL012,SHEEP RIVER AT OKOTOKS,50.72389,-113.97347,AB,UTC-07:00,4000765
05BL013,THREEPOINT CREEK NEAR MILLARVILLE,50.77113,-114.27874,AB,UTC-07:00,4000766
05BL014,SHEEP RIVER AT BLACK DIAMOND,50.68855,-114.24491,AB,UTC-07:00,4000767
05BL015,LITTLE BOW CANAL AT HIGH RIVER,50.5831,-113.86995,AB,UTC-07:00,4000768
05BL019,HIGHWOOD RIVER AT DIEBEL'S RANCH,50.40506,-114.50072,AB,UTC-07:00,4000769
05BL022,CATARACT CREEK NEAR FORESTRY ROAD,50.28526,-114.58871,AB,UTC-07:00,4000770
05BL023,PEKISKO CREEK NEAR LONGVIEW,50.47409,-114.2073,AB,UTC-07:00,4000771
05BL024,HIGHWOOD RIVER NEAR THE MOUTH,50.7825,-113.82267,AB,UTC-07:00,4000772
05BL027,TRAP CREEK NEAR LONGVIEW,50.47761,-114.42236,AB,UTC-07:00,4000773
05BM002,BOW RIVER BELOW CARSELAND DAM,50.82282,-113.44483,AB,UTC-07:00,4000774
05BM004,BOW RIVER BELOW BASSANO DAM,50.75018,-112.54225,AB,UTC-07:00,4000775
05BM007,PARFLESH CREEK NEAR CHANCELLOR,50.99449,-112.84209,AB,UTC-07:00,4000776
05BM008,CROWFOOT CREEK NEAR CLUNY,50.83462,-112.76305,AB,UTC-07:00,4000777
05BM014,WEST ARROWWOOD CREEK NEAR ARROWWOOD,50.76404,-113.23631,AB,UTC-07:00,4000778
05BM015,WESTERN IRRIGATION DISTRICT CANAL NEAR HEADGATES,51.04423,-114.00935,AB,UTC-07:00,4000779
05BM018,WEST ARROWWOOD CREEK NEAR ENSIGN,50.51377,-113.34436,AB,UTC-07:00,4000780
05BM020,EASTERN IRRIGATION DISTRICT MAIN BRANCH CANAL NEAR HEADGATE,50.74583,-112.51667,AB,UTC-07:00,4000781
05BM021,BOW RIVER DEVELOPMENT MAIN CANAL BELOW HEADGATES,50.82596,-113.4313,AB,UTC-07:00,4000782
05BN002,TWELVE MILE CREEK NEAR CECIL,50.14938,-111.66543,AB,UTC-07:00,4000783
05BN006,NEW WEST COULEE NEAR THE MOUTH,50.21665,-112.10495,AB,UTC-07:00,4000784
05BN008,BOW RIVER DEVELOPMENT DRAIN D NEAR VAUXHALL,50.1954,-112.04756,AB,UTC-07:00,4000785
05BN012,BOW RIVER NEAR THE MOUTH,50.04728,-111.59092,AB,UTC-07:00,4000786
05CA002,JAMES RIVER NEAR SUNDRE,51.92679,-114.68552,AB,UTC-07:00,4000787
05CA004,RED DEER RIVER ABOVE PANTHER RIVER,51.66051,-115.41056,AB,UTC-07:00,4000788
05CA009,RED DEER RIVER BELOW BURNT TIMBER CREEK,51.64625,-115.01925,AB,UTC-07:00,4000789
05CA011,BEARBERRY CREEK NEAR SUNDRE,51.80208,-114.66315,AB,UTC-07:00,4000790
05CA012,FALLENTIMBER CREEK NEAR SUNDRE,51.73671,-114.6545,AB,UTC-07:00,4000791
05CB001,LITTLE RED DEER RIVER NEAR THE MOUTH,52.02824,-114.14029,AB,UTC-07:00,4000792
05CB002,LITTLE RED DEER RIVER NEAR WATER VALLEY,51.51147,-114.67097,AB,UTC-07:00,4000793
05CB004,RAVEN RIVER NEAR RAVEN,52.08928,-114.47748,AB,UTC-07:00,4000794
05CB006,GLENIFFER RESERVOIR NEAR DICKSON,52.04644,-114.22881,AB,UTC-07:00,4000795
05CB007,DICKSON DAM TUNNEL OUTLET,52.05835,-114.21858,AB,UTC-07:00,4000796
05CC001,BLINDMAN RIVER NEAR BLACKFALDS,52.357,-113.795,AB,UTC-07:00,4000797
05CC002,RED DEER RIVER AT RED DEER,52.27053,-113.82311,AB,UTC-07:00,4000798
05CC003,SYLVAN LAKE AT SYLVAN LAKE,52.31137,-114.10332,AB,UTC-07:00,4000799
05CC006,GULL LAKE AT RV HEAVEN MARINA,52.6108,-114.05544,AB,UTC-07:00,4000800
05CC007,MEDICINE RIVER NEAR ECKVILLE,52.31956,-114.34417,AB,UTC-07:00,4000801
05CC008,BLINDMAN RIVER NEAR BLUFFTON,52.7563,-114.28556,AB,UTC-07:00,4000802
05CC009,LLOYD CREEK NEAR BLUFFTON,52.74038,-114.14684,AB,UTC-07:00,4000803
05CC010,BLOCK CREEK NEAR LEEDALE,52.57374,-114.57767,AB,UTC-07:00,4000804
05CC011,WASKASOO CREEK AT RED DEER,52.26849,-113.79985,AB,UTC-07:00,4000805
05CC013,LASTHILL CREEK NEAR ECKVILLE,52.36177,-114.45773,AB,UTC-07:00,4000806
05CD005,BUFFALO LAKE NEAR ERSKINE,52.46307,-112.88212,AB,UTC-07:00,4000807
05CD006,HAYNES CREEK NEAR HAYNES,52.33191,-113.36296,AB,UTC-07:00,4000808
05CD007,PARLBY CREEK AT ALIX,52.40747,-113.19576,AB,UTC-07:00,4000809
05CE001,RED DEER RIVER AT DRUMHELLER,51.46727,-112.71149,AB,UTC-07:00,4000810
05CE002,KNEEHILLS CREEK NEAR DRUMHELLER,51.46946,-112.97827,AB,UTC-07:00,4000811
05CE005,ROSEBUD RIVER AT REDLAND,51.29354,-113.0113,AB,UTC-07:00,4000812
05CE006,ROSEBUD RIVER BELOW CARSTAIRS CREEK,51.41583,-113.72778,AB,UTC-07:00,4000813
05CE007,THREEHILLS CREEK NEAR CARBON,51.56446,-113.07342,AB,UTC-07:00,4000814
05CE011,RENWICK CREEK NEAR THREE HILLS,51.71784,-113.36112,AB,UTC-07:00,4000815
05CE012,GHOSTPINE CREEK NEAR HUXLEY,51.89591,-113.24107,AB,UTC-07:00,4000816
05CE018,THREEHILLS CREEK BELOW RAY CREEK,51.99747,-113.56856,AB,UTC-07:00,4000817
05CE020,MICHICHI CREEK AT DRUMHELLER,51.47153,-112.71699,AB,UTC-07:00,4000818
05CG004,BULLPOUND CREEK NEAR WATTS,51.66211,-112.08397,AB,UTC-07:00,4000819
05CG006,FISH CREEK ABOVE LITTLE FISH LAKE,51.3908,-112.20187,AB,UTC-07:00,4000820
05CH007,BERRY CREEK NEAR THE MOUTH,50.85509,-111.59061,AB,UTC-07:00,4000821
05CH011,BERRY CREEK RESERVOIR OUTLET,51.23974,-111.63142,AB,UTC-07:00,4000822
05CH013,FORSTER RESERVOIR NEAR CESSFORD,50.98086,-111.76747,AB,UTC-07:00,4000823
05CH014,BERRY CREEK RESERVOIR NEAR SUNNYNOOK,51.25521,-111.64056,AB,UTC-07:00,4000824
05CJ006,ONETREE CREEK NEAR PATRICIA,50.73393,-111.68934,AB,UTC-07:00,4000825
05CJ012,MATZHIWIN CREEK BELOW WARE COULEE,50.82091,-111.82876,AB,UTC-07:00,4000826
05CK001,BLOOD INDIAN CREEK NEAR THE MOUTH,50.9583,-111.06004,AB,UTC-07:00,4000827
05CK004,RED DEER RIVER NEAR BINDLOSS,50.90269,-110.2995,AB,UTC-07:00,4000828
05CK005,ALKALI CREEK NEAR THE MOUTH,50.89896,-110.508,AB,UTC-07:00,4000829
05CK006,KENNEDY COULEE NEAR ACADIA VALLEY,51.09586,-110.25898,AB,UTC-07:00,4000830
05DA007,MISTAYA RIVER NEAR SASKATCHEWAN CROSSING,51.88427,-116.68919,AB,UTC-07:00,4000831
05DA009,NORTH SASKATCHEWAN RIVER AT WHIRLPOOL POINT,52.00119,-116.47093,AB,UTC-07:00,4000832
05DB002,PRAIRIE CREEK NEAR ROCKY MOUNTAIN HOUSE,52.27386,-114.92918,AB,UTC-07:00,4000833
05DB005,PRAIRIE CREEK BELOW LICK CREEK,52.25457,-115.28792,AB,UTC-07:00,4000834
05DB006,CLEARWATER RIVER NEAR DOVERCOURT,52.2521,-114.85582,AB,UTC-07:00,4000835
05DC001,NORTH SASKATCHEWAN RIVER NEAR ROCKY MOUNTAIN HOUSE,52.3767,-114.94132,AB,UTC-07:00,4000836
05DC011,NORTH RAM RIVER AT FORESTRY ROAD,52.28296,-115.99929,AB,UTC-07:00,4000837
05DD004,BROWN CREEK AT FORESTRY ROAD,52.76396,-116.36081,AB,UTC-07:00,4000838
05DD007,BRAZEAU RIVER BELOW CARDINAL RIVER,52.88158,-116.55625,AB,UTC-07:00,4000839
05DD009,NORDEGG RIVER AT SUNCHILD ROAD,52.81997,-115.52026,AB,UTC-07:00,4000840
05DE002,WABAMUN LAKE AT SUNDANCE POWER STATION,53.51658,-114.56089,AB,UTC-07:00,4000841
05DE007,ROSE CREEK NEAR ALDER FLATS,52.92991,-115.01102,AB,UTC-07:00,4000842
05DE009,TOMAHAWK CREEK NEAR TOMAHAWK,53.40585,-114.76311,AB,UTC-07:00,4000843
05DE010,NORTH SASKATCHEWAN RIVER AT HIGHWAY NO. 759,53.31548,-114.75796,AB,UTC-07:00,4000844
05DE011,NORTH SASKATCHEWAN RIVER AT HIGHWAY NO. 22,53.20706,-114.93033,AB,UTC-07:00,4000845
05DF001,NORTH SASKATCHEWAN RIVER AT EDMONTON,53.53721,-113.4855,AB,UTC-07:00,4000846
05DF003,BLACKMUD CREEK NEAR ELLERSLIE,53.41455,-113.51651,AB,UTC-07:00,4000847
05DF004,STRAWBERRY CREEK NEAR THE MOUTH,53.31149,-114.05207,AB,UTC-07:00,4000848
05DF006,WHITEMUD CREEK NEAR ELLERSLIE,53.41263,-113.59089,AB,UTC-07:00,4000849
05DF008,WEED CREEK AT THORSBY,53.23379,-114.0508,AB,UTC-07:00,4000850
05DF009,WHITEMUD CREEK AT EDMONTON,53.48302,-113.55455,AB,UTC-07:00,4000851
05EA001,STURGEON RIVER NEAR FORT SASKATCHEWAN,53.83276,-113.28236,AB,UTC-07:00,4000852
05EA002,STURGEON RIVER AT ST. ALBERT,53.63583,-113.62722,AB,UTC-07:00,4000853
05EA005,STURGEON RIVER NEAR VILLENEUVE,53.65535,-113.76247,AB,UTC-07:00,4000854
05EA006,LAC STE. ANNE AT ALBERTA BEACH,53.67765,-114.357,AB,UTC-07:00,4000855
05EA008,ISLE LAKE AT EUREKA BEACH,53.62597,-114.68638,AB,UTC-07:00,4000856
05EA010,STURGEON RIVER NEAR MAGNOLIA BRIDGE,53.59169,-114.86111,AB,UTC-07:00,4000857
05EA011,CARROT CREEK NEAR THE MOUTH,53.62339,-113.69531,AB,UTC-07:00,4000858
05EA012,ATIM CREEK AT CENTURY ROAD,53.59006,-113.88531,AB,UTC-07:00,4000859
05EA013,KILINI CREEK AT TWP ROAD NO 543,53.67213,-114.1355,AB,UTC-07:00,4000860
05EC005,REDWATER RIVER NEAR THE MOUTH,53.8966,-112.99602,AB,UTC-07:00,4000861
05ED002,ATIMOSWE CREEK NEAR ELK POINT,53.8888,-110.9211,AB,UTC-07:00,4000862
05EE005,STRETTON CREEK NEAR MARWAYNE,53.44246,-110.32566,AB,UTC-07:00,4000863
05EE006,VERMILION RIVER TRIBUTARY NEAR BRUCE,53.29409,-112.04985,AB,UTC-07:00,4000864
05EE007,VERMILION RIVER NEAR MARWAYNE,53.49162,-110.3988,AB,UTC-07:00,4000865
05EE008,VERMILION PARK LAKE NEAR VERMILION,53.36117,-110.86056,AB,UTC-07:00,4000866
05EE009,VERMILION RIVER AT VEGREVILLE,53.49118,-112.0398,AB,UTC-07:00,4000867
05EE010,VERMILION RIVER AT RANGE ROAD NO. 105,53.61928,-111.45168,AB,UTC-07:00,4000868
05EE011,VERMILION LAKES NEAR MORECAMBE,53.64189,-111.47577,AB,UTC-07:00,4000869
05EF001,NORTH SASKATCHEWAN RIVER NEAR DEER CREEK,53.52319,-109.61789,SK,UTC-06:00,4000870
05FA001,BATTLE RIVER NEAR PONOKA,52.66325,-113.58141,AB,UTC-07:00,4000871
05FA011,BATTLE RIVER AT DUHAMEL,52.94859,-112.96467,AB,UTC-07:00,4000872
05FA012,PIPESTONE CREEK NEAR WETASKIWIN,53.0368,-113.32314,AB,UTC-07:00,4000873
05FA013,PIGEON LAKE AT PIGEON LAKE PROVINCIAL PARK,53.02378,-114.1265,AB,UTC-07:00,4000874
05FA014,MASKWA CREEK NO. 1 ABOVE BEARHILLS LAKE,52.78509,-113.62909,AB,UTC-07:00,4000875
05FA016,COAL LAKE RESERVOIR NEAR WETASKIWIN,53.0031,-113.21913,AB,UTC-07:00,4000876
05FA024,WEILLER CREEK NEAR WETASKIWIN,52.95916,-113.27995,AB,UTC-07:00,4000877
05FA025,CAMROSE CREEK NEAR CAMROSE,53.04147,-112.82995,AB,UTC-07:00,4000878
05FB002,IRON CREEK NEAR HARDISTY,52.708,-111.31039,AB,UTC-07:00,4000879
05FC001,BATTLE RIVER NEAR FORESTBURG,52.57406,-112.34165,AB,UTC-07:00,4000880
05FC004,PAINTEARTH CREEK NEAR HALKIRK,52.38555,-112.13808,AB,UTC-07:00,4000881
05FC007,YOUNG CREEK NEAR CASTOR,52.25919,-111.7301,AB,UTC-07:00,4000882
05FC008,BATTLE RIVER AT HIGHWAY NO. 872,52.40182,-111.41142,AB,UTC-07:00,4000883
05FD001,RIBSTONE CREEK NEAR EDGERTON,52.75534,-110.48347,AB,UTC-07:00,4000884
05FE002,BUFFALO CREEK AT HIGHWAY NO. 41,53.00723,-110.86734,AB,UTC-07:00,4000885
05FE004,BATTLE RIVER NEAR THE SASKATCHEWAN BOUNDARY,52.85644,-110.01934,AB,UTC-06:00,4000886
05GA003,MONITOR CREEK NEAR MONITOR,51.96955,-110.57635,AB,UTC-07:00,4000887
05GA008,SOUNDING CREEK NEAR OYEN,51.56666,-110.4736,AB,UTC-07:00,4000888
05GD001,NORTH SASKATCHEWAN RIVER NEAR BORDEN,52.37222,-107.148,SK,UTC-06:00,4000889
05GG001,NORTH SASKATCHEWAN RIVER AT PRINCE ALBERT,53.20346,-105.7725,SK,UTC-06:00,4000890
05HA003,BEAR CREEK NEAR PIAPOT,49.89942,-109.10619,SK,UTC-06:00,4000891
05HC005,ANTELOPE CREEK NEAR CABRI,50.66197,-108.3815,SK,UTC-06:00,4000892
05HD036,SWIFT CURRENT CREEK BELOW ROCK CREEK,49.84444,-108.47944,SK,UTC-06:00,4000893
05HD039,SWIFT CURRENT CREEK NEAR LEINAN,50.49389,-107.65861,SK,UTC-06:00,4000894
05HD042,ILLERBRUN CREEK NEAR SIMMIE,49.93192,-108.25897,SK,UTC-06:00,4000895
05HF003,LAKE DIEFENBAKER AT GARDINER DAM,51.28025,-106.83919,SK,UTC-06:00,4000896
05HG001,SOUTH SASKATCHEWAN RIVER AT SASKATOON,52.14067,-106.64431,SK,UTC-06:00,4000897
05HG002,BRIGHTWATER CREEK NEAR KENASTON,51.56231,-106.50083,SK,UTC-06:00,4000898
05HG021,INVERNESS CREEK NEAR BRODERICK,51.50408,-106.82089,SK,UTC-06:00,4000899
05JA002,WOOD RIVER NEAR LAFLECHE,49.66861,-106.69416,SK,UTC-06:00,4000900
05JA005,WOOD RIVER NEAR MCCORD,49.49478,-106.78678,SK,UTC-06:00,4000901
05JA006,SIX MILE CREEK NEAR GLENTWORTH,49.49603,-106.75489,SK,UTC-06:00,4000902
05JB001,NOTUKEU CREEK NEAR VANGUARD,49.91747,-107.18633,SK,UTC-06:00,4000903
05JB004,NOTUKEU CREEK ABOVE ADMIRAL RESERVOIR,49.7091,-108.12658,SK,UTC-06:00,4000904
05JC004,RUSHLAKE CREEK ABOVE HIGHFIELD RESERVOIR,50.25297,-107.46981,SK,UTC-06:00,4000905
05JE006,MOOSE JAW RIVER NEAR BURDICK,50.40033,-105.39786,SK,UTC-06:00,4000906
05JF001,QU'APPELLE RIVER NEAR LUMSDEN,50.65047,-104.86678,SK,UTC-06:00,4000907
05JF005,WASCANA CREEK NEAR LUMSDEN,50.63556,-104.90978,SK,UTC-06:00,4000908
05JF006,BOGGY CREEK NEAR LUMSDEN,50.58472,-104.81803,SK,UTC-06:00,4000909
05JF008,FAHLMAN CREEK NEAR DAVIN,50.36883,-104.19228,SK,UTC-06:00,4000910
05JF011,COTTONWOOD CREEK NEAR LUMSDEN,50.59056,-104.90861,SK,UTC-06:00,4000911
05JG004,QU'APPELLE RIVER ABOVE BUFFALO POUND LAKE,50.78333,-105.84014,SK,UTC-06:00,4000912
05JG006,ELBOW DIVERSION CANAL AT DROP STRUCTURE,50.97864,-106.39847,SK,UTC-06:00,4000913
05JG013,RIDGE CREEK NEAR BRIDGEFORD,50.95133,-106.3295,SK,UTC-06:00,4000914
05JH004,LAST MOUNTAIN LAKE AT ROWAN'S RAVINE,50.99564,-105.18386,SK,UTC-06:00,4000915
05JJ003,LANIGAN CREEK ABOVE BOULDER LAKE,51.64986,-105.23811,SK,UTC-06:00,4000916
05JJ009,SALINE CREEK NEAR NOKOMIS,51.41611,-105.10306,SK,UTC-06:00,4000917
05JK002,QU'APPELLE RIVER BELOW CRAVEN DAM,50.70653,-104.79792,SK,UTC-06:00,4000918
05JK004,JUMPING DEER CREEK NEAR LIPTON,50.91597,-103.90156,SK,UTC-06:00,4000919
05JK007,QU'APPELLE RIVER BELOW LOON CREEK,50.78781,-104.28272,SK,UTC-06:00,4000920
05JL005,PHEASANT CREEK NEAR ABERNETHY,50.73417,-103.328,SK,UTC-06:00,4000921
05JM001,QU'APPELLE RIVER NEAR WELBY,50.49128,-101.55856,SK,UTC-06:00,4000922
05JM010,EKAPO CREEK NEAR MARIEVAL,50.53139,-102.71006,SK,UTC-06:00,4000923
05JM015,CUTARM CREEK NEAR SPY HILL,50.59042,-101.74286,SK,UTC-06:00,4000924
05KD003,SASKATCHEWAN RIVER BELOW TOBIN LAKE,53.70714,-103.29872,SK,UTC-06:00,4000925
05KD004,TOBIN LAKE AT THE SPILLWAY,53.65719,-103.39561,SK,UTC-06:00,4000926
05KD007,SASKATCHEWAN RIVER BELOW THE FORKS,53.24611,-105.06833,SK,UTC-06:00,4000927
05KE010,WHITE GULL CREEK AT HIGHWAY NO. 106,53.86497,-104.61964,SK,UTC-06:00,4000928
05KH007,CARROT RIVER NEAR TURNBERRY,53.61369,-102.10378,SK,UTC-06:00,4000929
05KH009,SASKATCHEWAN RIVER OLD CHANNEL,53.83436,-102.94424,SK,UTC-06:00,4000930
05KH015,CARROT RIVER NEAR THE PAS,53.806,-101.37486,MB,UTC-06:00,4000931
05KJ001,SASKATCHEWAN RIVER AT THE PAS,53.83806,-101.20872,MB,UTC-06:00,4000932
05KK002,CORMORANT LAKE AT CORMORANT,54.22331,-100.60397,MB,UTC-06:00,4000933
05KK005,NORTH MOOSE LAKE AT MOOSE LAKE NARROWS CONTROL STRUCTURE,53.93829,-100.14667,MB,UTC-06:00,4000934
05KK006,SOUTH MOOSE LAKE AT MOOSE LAKE NARROWS CONTROL STRUCTURE,53.9382,-100.1458,MB,UTC-06:00,4000935
05LC001,RED DEER RIVER NEAR ERWOOD,52.85947,-102.19506,SK,UTC-06:00,4000936
05LC004,RED DEER RIVER NEAR THE MOUTH,52.87628,-101.04939,MB,UTC-06:00,4000937
05LD001,OVERFLOWING RIVER AT OVERFLOWING RIVER,53.14294,-101.1025,MB,UTC-06:00,4000938
05LD002,LAKE WINNIPEGOSIS AT DAWSON BAY,52.97453,-100.97897,MB,UTC-06:00,4000939
05LE001,SWAN RIVER AT SWAN RIVER,52.12072,-101.25167,MB,UTC-06:00,4000940
05LE004,WOODY RIVER NEAR BOWSMAN,52.25969,-101.14161,MB,UTC-06:00,4000941
05LE005,ROARING RIVER NEAR MINITONAS,52.15098,-101.06086,MB,UTC-06:00,4000942
05LE006,SWAN RIVER NEAR MINITONAS,52.196,-101.06083,MB,UTC-06:00,4000943
05LE010,BIRCH RIVER NEAR BIRCH RIVER,52.37006,-101.08661,MB,UTC-06:00,4000944
05LG003,GARLAND RIVER NEAR GARLAND,51.66739,-100.48961,MB,UTC-06:00,4000945
05LG004,NORTH DUCK RIVER AT COWAN,52.03133,-100.64994,MB,UTC-06:00,4000946
05LH001,LAKE WINNIPEGOSIS AT WINNIPEGOSIS,51.647,-99.92344,MB,UTC-06:00,4000947
05LH005,WATERHEN RIVER NEAR WATERHEN,51.8485,-99.54617,MB,UTC-06:00,4000948
05LJ005,OCHRE RIVER AT OCHRE RIVER,51.0515,-99.78808,MB,UTC-06:00,4000949
05LJ007,TURTLE RIVER NEAR LAURIER,50.94881,-99.52675,MB,UTC-06:00,4000950
05LJ009,DAUPHIN LAKE AT OUTLET,51.43992,-99.95039,MB,UTC-06:00,4000951
05LJ010,VALLEY RIVER NEAR DAUPHIN,51.28247,-100.01653,MB,UTC-06:00,4000952
05LJ012,VERMILION RIVER NEAR DAUPHIN,51.18747,-100.01611,MB,UTC-06:00,4000953
05LJ019,MINK CREEK NEAR ETHELBERT,51.41414,-100.35428,MB,UTC-06:00,4000954
05LJ025,MOSSY RIVER BELOW OUTLET OF DAUPHIN LAKE,51.45033,-99.97108,MB,UTC-06:00,4000955
05LJ027,MCKINNON CREEK NEAR MCCREARY,50.8015,-99.48533,MB,UTC-06:00,4000956
05LJ045,WILSON RIVER NEAR ASHVILLE,51.15614,-100.3325,MB,UTC-06:00,4000957
05LK002,LAKE MANITOBA AT STEEP ROCK,51.44381,-98.80264,MB,UTC-06:00,4000958
05LL002,WHITEMUD RIVER AT WESTBOURNE,50.13494,-98.58406,MB,UTC-06:00,4000959
05LL005,WHITEMUD RIVER NEAR KEYES,50.18528,-99.10997,MB,UTC-06:00,4000960
05LL012,LAKE MANITOBA NEAR WESTBOURNE,50.25142,-98.58762,MB,UTC-06:00,4000961
05LL014,PINE CREEK NEAR MELBOURNE,49.90092,-99.21439,MB,UTC-06:00,4000962
05LL015,BIG GRASS RIVER NEAR GLENELLA,50.50569,-98.97028,MB,UTC-06:00,4000963
05LL021,RAT CREEK NEAR MACDONALD,49.98411,-98.46872,MB,UTC-06:00,4000964
05LL027,PELICAN CREEK SOUTH TRIBUTARY NEAR BIRNIE,50.47693,-99.47728,MB,UTC-06:00,4000965
05LM001,FAIRFORD RIVER NEAR FAIRFORD,51.58733,-98.71181,MB,UTC-06:00,4000966
05LM005,LAKE ST. MARTIN NEAR HILBRE,51.50883,-98.52889,MB,UTC-06:00,4000967
05LM006,DAUPHIN RIVER NEAR DAUPHIN RIVER,52.00195,-98.32978,MB,UTC-06:00,4000968
05LN006,BURNT LAKE DRAIN NORTHWEST OF LUNDAR,50.72078,-98.07567,MB,UTC-06:00,4000969
05MA002,LITTLE QUILL LAKE NEAR WYNYARD,51.87431,-104.13267,SK,UTC-06:00,4000970
05MA010,BIG QUILL LAKE NEAR KANDAHAR,51.78137,-104.32448,SK,UTC-06:00,4000971
05MA012,IRONSPRING CREEK NEAR WATSON,52.05683,-104.49983,SK,UTC-06:00,4000972
05MA016,ROMANCE CREEK NEAR WATSON,51.99397,-104.55392,SK,UTC-06:00,4000973
05MA020,QUILL CREEK NEAR QUILL LAKE,52.01367,-104.25039,SK,UTC-06:00,4000974
05MA021,MAGNUSSON CREEK NEAR WYNYARD,51.81422,-104.20531,SK,UTC-06:00,4000975
05MA025,RANCH CREEK ABOVE RANCH LAKE,52.40553,-104.78925,SK,UTC-06:00,4000976
