ID,Name / Nom,Latitude,Longitude,Prov/Terr,Timezone / Fuseau horaire,wflow_code
01AD003,ST. FRANCIS RIVER AT OUTLET OF GLASIER LAKE,47.20661,-68.95694,NB,UTC-04:00,4000000
01AD004,SAINT JOHN RIVER AT EDMUNDSTON,47.36078,-68.32489,NB,UTC-04:00,4000001
01AF002,SAINT JOHN RIVER AT GRAND FALLS,47.03889,-67.73972,NB,UTC-04:00,4000002
01AF007,GRANDE RIVIERE AT VIOLETTE BRIDGE,47.24697,-67.92128,NB,UTC-04:00,4000003
01AF009,IROQUOIS RIVER AT MOULIN MORNEAULT,47.45783,-68.35683,NB,UTC-04:00,4000004
01AG003,AROOSTOOK RIVER NEAR TINKER,46.81636,-67.75197,NB,UTC-04:00,4000005
01AH002,TOBIQUE RIVER AT RILEY BROOK,47.17303,-67.21081,NB,UTC-04:00,4000006
01AJ003,MEDUXNEKEAG RIVER NEAR BELLEVILLE,46.21622,-67.72794,NB,UTC-04:00,4000007
01AJ004,BIG PRESQUE ISLE STREAM AT TRACEY MILLS,46.43836,-67.73844,NB,UTC-04:00,4000008
01AJ010,BECAGUIMEC STREAM AT COLDSTREAM,46.34089,-67.46511,NB,UTC-04:00,4000009
01AK001,SHOGOMOC STREAM NEAR TRANS CANADA HIGHWAY,45.94353,-67.32036,NB,UTC-04:00,4000010
01AK003,SAINT JOHN RIVER AT FREDERICTON,45.96619,-66.65161,NB,UTC-04:00,4000011
01AK006,MIDDLE BRANCH NASHWAAKSIS STREAM AT SANDWITH'S FARM,46.08281,-66.73303,NB,UTC-04:00,4000012
01AK007,NACKAWIC STREAM NEAR TEMPERANCE VALE,46.04878,-67.23961,NB,UTC-04:00,4000013
01AL002,NASHWAAK RIVER AT DURHAM BRIDGE,46.12592,-66.61131,NB,UTC-04:00,4000014
01AL004,NARROWS MOUNTAIN BROOK NEAR NARROWS MOUNTAIN,46.27717,-67.02139,NB,UTC-04:00,4000015
01AM001,NORTH BRANCH OROMOCTO RIVER AT TRACY,45.67378,-66.68289,NB,UTC-04:00,4000016
01AN002,SALMON RIVER AT CASTAWAY,46.29072,-65.72275,NB,UTC-04:00,4000017
01AO002,SAINT JOHN RIVER AT MAUGERVILLE,45.86647,-66.45317,NB,UTC-04:00,4000018
01AO003,GRAND LAKE AT NEWCASTLE CREEK,46.0564,-66.0057,NB,UTC-04:00,4000019
01AO004,JEMSEG RIVER AT JEMSEG,45.82892,-66.11542,NB,UTC-04:00,4000020
01AO010,FRENCH LAKE AT LAKEVILLE CORNER,45.90883,-66.25644,NB,UTC-04:00,4000021
01AO011,SAINT JOHN RIVER AT UPPER GAGETOWN,45.84725,-66.23486,NB,UTC-04:00,4000022
01AO012,SAINT JOHN RIVER AT GAGETOWN,45.76867,-66.14036,NB,UTC-04:00,4000023
01AP002,CANAAN RIVER AT EAST CANAAN,46.07236,-65.36639,NB,UTC-04:00,4000024
01AP003,SAINT JOHN RIVER AT OAK POINT,45.51942,-66.07661,NB,UTC-04:00,4000025
01AP004,KENNEBECASIS RIVER AT APOHAQUI,45.70139,-65.60169,NB,UTC-04:00,4000026
01AP005,SAINT JOHN RIVER AT SAINT JOHN,45.27339,-66.08889,NB,UTC-04:00,4000027
01AQ001,LEPREAU RIVER AT LEPREAU,45.16978,-66.46828,NB,UTC-04:00,4000028
01AQ002,MAGAGUADAVIC RIVER AT ELMCROFT,45.27333,-66.80667,NB,UTC-04:00,4000029
01AQ007,MAGAGUADAVIC LAKE NEAR UPPER MAGAGUADAVIC,45.71975,-67.18356,NB,UTC-04:00,4000030
01AR006,DENNIS STREAM NEAR ST. STEPHEN,45.20903,-67.26215,NB,UTC-04:00,4000031
01AR009,GRAND LAKE AT FOREST CITY,45.66489,-67.73589,NB,UTC-05:00,4000032
01AR010,SPEDNIC LAKE AT ST. CROIX,45.56922,-67.42725,NB,UTC-04:00,4000033
01AR011,FOREST CITY STREAM BELOW FOREST CITY DAM,45.66417,-67.73356,NB,UTC-05:00,4000034
01AR013,GRAND FALLS FLOWAGE AT GRAND FALLS,45.274323,-67.479636,NB,UTC-05:00,4000035
01BC001,RESTIGOUCHE RIVER BELOW KEDGWICK RIVER,47.66708,-67.48308,NB,UTC-04:00,4000036
01BE001,UPSALQUITCH RIVER AT UPSALQUITCH,47.83247,-66.88708,NB,UTC-04:00,4000037
01BJ003,JACQUET RIVER NEAR DURHAM CENTRE,47.89381,-66.02522,NB,UTC-04:00,4000038
01BJ007,RESTIGOUCHE RIVER ABOVE RAFTING GROUND BROOK,47.90867,-66.94806,NB,UTC-04:00,4000039
01BJ010,MIDDLE RIVER NEAR BATHURST,47.60839,-65.72181,NB,UTC-04:00,4000040
01BJ012,EEL RIVER NEAR DUNDEE,47.98789,-66.49061,NB,UTC-04:00,4000041
01BL002,RIVIERE CARAQUET AT BURNSVILLE,47.70561,-65.15539,NB,UTC-04:00,4000042
01BO001,SOUTHWEST MIRAMICHI RIVER AT BLACKVILLE,46.736,-65.82561,NB,UTC-04:00,4000043
01BP001,LITTLE SOUTHWEST MIRAMICHI RIVER AT LYTTLETON,46.93597,-65.90739,NB,UTC-04:00,4000044
01BP002,CATAMARAN BROOK AT REPAP ROAD BRIDGE,46.85656,-66.19011,NB,UTC-04:00,4000045
01BQ001,NORTHWEST MIRAMICHI RIVER AT TROUT BROOK,47.09475,-65.8365,NB,UTC-04:00,4000046
01BS001,COAL BRANCH RIVER AT BEERSVILLE,46.44394,-65.06494,NB,UTC-04:00,4000047
01BU002,PETITCODIAC RIVER NEAR PETITCODIAC,45.94639,-65.16819,NB,UTC-04:00,4000048
01BU009,HOLMES BROOK SITE NO. 9 NEAR PETITCODIAC,45.88786,-65.14678,NB,UTC-04:00,4000049
01BV004,BLACK RIVER AT GARNET SETTLEMENT,45.30658,-65.84922,NB,UTC-04:00,4000050
01BV006,POINT WOLFE RIVER AT FUNDY NATIONAL PARK,45.55856,-65.01597,NB,UTC-04:00,4000051
01CA003,CARRUTHERS BROOK NEAR ST. ANTHONY,46.74411,-64.187,PE,UTC-04:00,4000052
01CB004,WILMOT RIVER NEAR WILMOT VALLEY,46.39331,-63.65939,PE,UTC-04:00,4000053
01CB018,BARBARA WEIT STREAM AT CAVENDISH FARM,46.4275,-63.68042,PE,UTC-04:00,4000054
01CC002,WINTER RIVER NEAR SUFFOLK,46.33206,-63.06547,PE,UTC-04:00,4000055
01CC005,WEST RIVER AT RIVERDALE,46.23139,-63.35108,PE,UTC-04:00,4000056
01CC010,WINTER RIVER AT UNION,46.31481,-63.12336,PE,UTC-04:00,4000057
01CC011,COLES CREEK AT MILTONVALE PUMPING STATION,46.31025,-63.19489,PE,UTC-04:00,4000058
01CD005,BEAR RIVER AT ST. MARGARETS,46.45314,-62.38233,PE,UTC-04:00,4000059
01DC005,ANNAPOLIS RIVER AT WILMOT,44.94919,-65.02939,NS,UTC-04:00,4000060
01DC007,ANNAPOLIS RIVER AT LAWRENCETOWN,44.88083,-65.15792,NS,UTC-04:00,4000061
01DD002,CORNWALLIS RIVER AT CAMBRIDGE STATION,45.06478,-64.63533,NS,UTC-04:00,4000062
01DD005,NORTH BROOK AT SHEFFIELD MILLS,45.15056,-64.475,NS,UTC-04:00,4000063
01DG003,BEAVERBANK RIVER NEAR KINSAC,44.85111,-63.66389,NS,UTC-04:00,4000064
01DG004,BENNERY LAKE OUTLET NEAR ENFIELD,44.90294,-63.55167,NS,UTC-04:00,4000065
01DG043,ST ANDREWS RIVER AT STEWIACKE,45.12056,-63.34278,NS,UTC-04:00,4000066
01DH002,SALMON RIVER AT MURRAY,45.36917,-63.21544,NS,UTC-04:00,4000067
01DH004,NORTH RIVER AT NORTH RIVER,45.42556,-63.25472,NS,UTC-04:00,4000068
01DH006,MCCLURES BROOK AT COBEQUID TRAIL,45.35883,-63.29589,NS,UTC-04:00,4000069
01DJ005,GREAT VILLAGE RIVER NEAR SCRABBLE HILL,45.43822,-63.598,NS,UTC-04:00,4000070
01DL001,KELLEY RIVER (MILL CREEK) AT EIGHT MILE FORD,45.58681,-64.45069,NS,UTC-04:00,4000071
01DP004,MIDDLE RIVER OF PICTOU AT ROCKLIN,45.49739,-62.78019,NS,UTC-04:00,4000072
01DR001,SOUTH RIVER AT ST. ANDREWS,45.55972,-61.90364,NS,UTC-04:00,4000073
01EA003,TUSKET RIVER AT WILSON'S BRIDGE,43.92481,-65.86853,NS,UTC-04:00,4000074
01EC001,ROSEWAY RIVER AT LOWER OHIO,43.83736,-65.36911,NS,UTC-04:00,4000075
01ED005,MERSEY RIVER BELOW GEORGE LAKE,44.33314,-65.20508,NS,UTC-04:00,4000076
01ED007,MERSEY RIVER BELOW MILL FALLS,44.43678,-65.22186,NS,UTC-04:00,4000077
01ED013,SHELBURNE RIVER AT POLLARD'S FALLS BRIDGE,44.21542,-65.24142,NS,UTC-04:00,4000078
01EE005,MOOSE PIT BROOK AT TUPPER LAKE,44.46183,-65.04778,NS,UTC-04:00,4000079
01EF001,LAHAVE RIVER AT WEST NORTHFIELD,44.44744,-64.59119,NS,UTC-04:00,4000080
01EJ001,SACKVILLE RIVER AT BEDFORD,44.73153,-63.66044,NS,UTC-04:00,4000081
01EJ004,LITTLE SACKVILLE RIVER AT MIDDLE SACKVILLE,44.76447,-63.6875,NS,UTC-04:00,4000082
01EJ009,TOMAHAWK LAKE NEAR HAMMONDS PLAINS,44.78083,-63.79017,NS,UTC-04:00,4000083
01EJ010,TOMAHAWK LAKE OUTLET NEAR HAMMONDS PLAINS,44.78106,-63.78975,NS,UTC-04:00,4000084
01EO001,ST. MARYS RIVER AT STILLWATER,45.17439,-61.97992,NS,UTC-04:00,4000085
01FA001,RIVER INHABITANTS AT GLENORA,45.72025,-61.28611,NS,UTC-04:00,4000086
01FB001,NORTHEAST MARGAREE RIVER AT MARGAREE VALLEY,46.36897,-60.97528,NS,UTC-04:00,4000087
01FB003,SOUTHWEST MARGAREE RIVER NEAR UPPER MARGAREE,46.22311,-61.13692,NS,UTC-04:00,4000088
01FC002,CHETICAMP RIVER ABOVE ROBERT BROOK,46.64158,-60.94611,NS,UTC-04:00,4000089
01FE002,INDIAN BROOK AT INDIAN BROOK,46.37172,-60.53369,NS,UTC-04:00,4000090
01FF001,MIDDLE RIVER AT MACLENNANS CROSS,46.19,-60.94181,NS,UTC-04:00,4000091
01FG001,RIVER DENYS AT BIG MARSH,45.89369,-61.20475,NS,UTC-04:00,4000092
01FJ002,MACASKILLS BROOK NEAR BIRCH GROVE,46.11789,-60.00467,NS,UTC-04:00,4000093
02AB006,KAMINISTIQUIA RIVER AT KAMINISTIQUIA,48.53231,-89.595,ON,UTC-05:00,4000094
02AB008,NEEBING RIVER NEAR THUNDER BAY,48.38339,-89.30656,ON,UTC-05:00,4000095
02AB014,NORTH CURRENT RIVER NEAR THUNDER BAY,48.51956,-89.17503,ON,UTC-05:00,4000096
02AB017,WHITEFISH RIVER AT NOLALU,48.29211,-89.80986,ON,UTC-05:00,4000097
02AB019,MCVICAR CREEK AT THUNDER BAY,48.4492,-89.21861,ON,UTC-05:00,4000098
02AB020,MCINTYRE RIVER ABOVE THUNDER BAY,48.48269,-89.32464,ON,UTC-05:00,4000099
02AB021,CURRENT RIVER AT STEPSTONE,48.56244,-89.24067,ON,UTC-05:00,4000100
02AB022,CORBETT CREEK NEAR MURILLO,48.42862,-89.545632,ON,UTC-05:00,4000101
02AB023,SLATE RIVER NEAR THUNDER BAY,48.32576,-89.40421,ON,UTC-05:00,4000102
02AB024,NEEBING RIVER NEAR INTOLA,48.44281,-89.35776,ON,UTC-05:00,4000103
02AB025,KAMINISTIQUIA RIVER AT WEST FORT WILLIAM,48.34633,-89.35956,ON,UTC-05:00,4000104
02AB027,WHITEFISH RIVER NEAR STANLEY,48.3593,-89.60352,ON,UTC-05:00,4000105
02AC001,WOLF RIVER AT HIGHWAY NO. 17,48.82169,-88.53461,ON,UTC-05:00,4000106
02AC002,BLACK STURGEON RIVER AT HIGHWAY NO. 17,48.90422,-88.37686,ON,UTC-05:00,4000107
02AD010,BLACKWATER RIVER AT BEARDMORE,49.59761,-87.96544,ON,UTC-05:00,4000108
02AD012,NIPIGON RIVER BELOW ALEXANDER GENERATING STATION,49.1227,-88.35787,ON,UTC-05:00,4000109
02AE001,GRAVEL RIVER NEAR CAVERS,48.926,-87.69019,ON,UTC-05:00,4000110
02BA003,LITTLE PIC RIVER NEAR COLDWELL,48.84911,-86.607223,ON,UTC-05:00,4000111
02BA005,WHITESAND RIVER ABOVE SCHREIBER AT MINOVA MINE,48.97811,-87.37678,ON,UTC-05:00,4000112
02BA006,STEEL RIVER BELOW SANTOY LAKE,48.81371,-86.859337,ON,UTC-05:00,4000113
02BB003,PIC RIVER NEAR MARATHON,48.77408,-86.29661,ON,UTC-05:00,4000114
02BB004,CEDAR CREEK NEAR HEMLO,48.70542,-85.90794,ON,UTC-05:00,4000115
02BC006,PUKASKWA RIVER BELOW FOX RIVER,48.16039,-85.73092,ON,UTC-05:00,4000116
02BC007,WHITE LAKE AT WHITE LAKE PROVINCIAL PARK,48.69289,-85.64214,ON,UTC-05:00,4000117
02BC008,WHITE RIVER ABOVE OSKABUKUTA RIVER,48.58783,-85.89128,ON,UTC-05:00,4000118
02BD005,MAGPIE RIVER AT ESNAGI LAKE,48.48044,-84.53269,ON,UTC-05:00,4000119
02BF001,BATCHAWANA RIVER NEAR BATCHAWANA,47.00353,-84.51556,ON,UTC-05:00,4000120
02BF002,GOULAIS RIVER NEAR SEARCHMONT,46.86094,-83.97181,ON,UTC-05:00,4000121
02BF004,BIG CARP RIVER NEAR SAULT STE. MARIE,46.51589,-84.46518,ON,UTC-05:00,4000122
02BF014,GOULAIS RIVER NEAR KIRBY'S CORNER,46.71739,-84.28478,ON,UTC-05:00,4000123
02CA002,ROOT RIVER AT SAULT STE. MARIE,46.56286,-84.28169,ON,UTC-05:00,4000124
02CA003,ST. MARYS RIVER NEAR GARDEN RIVER,46.53258,-84.13125,ON,UTC-05:00,4000125
02CA007,THESSALON RIVER NEAR POPLAR DALE,46.53047,-83.70961,ON,UTC-05:00,4000126
02CB003,AUBINADONG RIVER ABOVE SESABIC CREEK,46.96842,-83.41686,ON,UTC-05:00,4000127
02CC005,LITTLE WHITE RIVER NEAR BELLINGHAM,46.39395,-83.28298,ON,UTC-05:00,4000128
02CC008,MISSISSAGI RIVER AT MISSISSAGI CHUTE,46.20136,-83.02539,ON,UTC-05:00,4000129
02CC010,LITTLE WHITE RIVER BELOW BOLAND RIVER,46.58114,-82.968,ON,UTC-05:00,4000130
02CD001,SERPENT RIVER AT HIGHWAY NO. 17,46.21078,-82.51242,ON,UTC-05:00,4000131
02CD006,SERPENT RIVER ABOVE QUIRKE LAKE,46.51158,-82.60028,ON,UTC-05:00,4000132
02CE002,AUX SABLES RIVER AT MASSEY,46.21494,-82.07081,ON,UTC-05:00,4000133
02CE007,MINISTIC CREEK ABOVE AGNEW LAKE,46.42957,-81.60033,ON,UTC-05:00,4000134
02CF005,JUNCTION CREEK AT SUDBURY,46.47872,-81.01042,ON,UTC-05:00,4000135
02CF007,WHITSON RIVER AT CHELMSFORD,46.58336,-81.19911,ON,UTC-05:00,4000136
02CF008,WHITSON RIVER AT VAL CARON,46.61017,-81.03297,ON,UTC-05:00,4000137
02CF010,ONAPING RIVER NEAR LEVACK,46.5995,-81.38197,ON,UTC-05:00,4000138
02CF011,VERMILION RIVER NEAR VAL CARON,46.68544,-81.00925,ON,UTC-05:00,4000139
02CF012,JUNCTION CREEK BELOW KELLEY LAKE,46.42731,-81.09844,ON,UTC-05:00,4000140
02CF013,MOOSE CREEK AT LEVACK,46.63594,-81.39147,ON,UTC-05:00,4000141
02CF014,VERMILION RIVER NEAR MILNET,46.81944,-80.95714,ON,UTC-05:00,4000142
02CG003,BLUE JAY CREEK NEAR TEHKUMMAH,45.65169,-81.98661,ON,UTC-05:00,4000143
02CG005,MINDEMOYA LAKE AT MINDEMOYA,45.74989,-82.18489,ON,UTC-05:00,4000144
02CH001,FROOD LAKE NEAR WHITEFISH FALLS,46.11861,-81.72839,ON,UTC-05:00,4000145
02CH002,PANACHE LAKE AT JACKSON'S POINT,46.27358,-81.34458,ON,UTC-05:00,4000146
02DB005,WANAPITEI RIVER NEAR WANUP,46.34567,-80.83956,ON,UTC-05:00,4000147
02DB007,CONISTON CREEK ABOVE WANAPITEI RIVER,46.47528,-80.82153,ON,UTC-05:00,4000148
02DB008,WANAPITEI RIVER AT HIGHWAY 637,46.15997,-80.9232,ON,UTC-05:00,4000149
02DC004,STURGEON RIVER NEAR GLEN AFTON,46.63717,-80.26325,ON,UTC-05:00,4000150
02DC012,STURGEON RIVER AT UPPER GOOSE FALLS,46.97025,-80.45878,ON,UTC-05:00,4000151
02DC013,LITTLE STURGEON RIVER BELOW BOOTH LAKE,46.42761,-79.66203,ON,UTC-05:00,4000152
02DD006,LAKE NIPISSING AT NORTH BAY,46.31183,-79.47381,ON,UTC-05:00,4000153
02DD010,FRENCH RIVER AT DRY PINE BAY,46.06858,-80.61164,ON,UTC-05:00,4000154
02DD012,VEUVE RIVER NEAR VERNER,46.40819,-80.12281,ON,UTC-05:00,4000155
02DD013,LA VASE RIVER AT NORTH BAY,46.26344,-79.39511,ON,UTC-05:00,4000156
02DD014,CHIPPEWA CREEK AT NORTH BAY,46.31178,-79.44836,ON,UTC-05:00,4000157
02DD015,COMMANDA CREEK NEAR COMMANDA,45.94919,-79.60658,ON,UTC-05:00,4000158
02DD017,FRENCH RIVER AT CHAUDIERE DAM,46.12083,-80.0275,ON,UTC-05:00,4000159
02DD020,LITTLE FRENCH RIVER AT OKIKENDAWT ISLAND,46.12314,-80.07911,ON,UTC-05:00,4000160
02DD021,LAKE NIPISSING AT FRENCH RIVER OUTLET,46.12553,-80.01231,ON,UTC-05:00,4000161
02DD022,DOLLARS LAKE BELOW S NARROWS,45.92039,-80.24175,ON,UTC-05:00,4000162
02DD023,FOREST LAKE AT SOUTH RIVER,45.83969,-79.35692,ON,UTC-05:00,4000163
02DD024,WASI RIVER NEAR ASTORVILLE,46.17842,-79.30989,ON,UTC-05:00,4000164
02DD025,FRENCH RIVER AT HARTLEY BAY,46.03522,-80.76011,ON,UTC-05:00,4000165
02DD026,FRENCH RIVER AT WOLSELEY BAY,46.10572,-80.26528,ON,UTC-05:00,4000166
02DD027,FRENCH RIVER BELOW PORTAGE DAM,46.1205,-80.01808,ON,UTC-05:00,4000167
02DD028,PICKEREL RIVER ABOVE CANTIN LAKE,45.98491,-80.41043,ON,UTC-05:00,4000168
02DD032,LAKE NIPISSING AT WEST BAY,46.22597,-80.31278,ON,UTC-05:00,4000169
02EA005,NORTH MAGNETAWAN RIVER NEAR BURK'S FALLS,45.66947,-79.37919,ON,UTC-05:00,4000170
02EA010,NORTH MAGNETAWAN RIVER ABOVE PICKEREL LAKE,45.70377,-79.30879,ON,UTC-05:00,4000171
02EA011,MAGNETAWAN RIVER NEAR BRITT,45.77306,-80.48233,ON,UTC-05:00,4000172
02EA015,CECEBE LAKE AT MAGNETAWAN,45.66497,-79.64097,ON,UTC-05:00,4000173
02EA016,DOE LAKE NEAR KATRINE,45.57195,-79.36685,ON,UTC-05:00,4000174
02EA018,MAGNETAWAN RIVER NEAR EMSDALE,45.5567,-79.28798,ON,UTC-05:00,4000175
02EA019,AHMIC LAKE NEAR AHMIC HARBOUR,45.66907,-79.74521,ON,UTC-05:00,4000176
02EA020,BERNARD LAKE AT SUNDRIDGE,45.718,-79.41733,ON,UTC-05:00,4000177
02EA021,SHAWANAGA RIVER BELOW SHAWANAGA LAKE,45.55894,-80.03797,ON,UTC-05:00,4000178
02EB004,NORTH BRANCH MUSKOKA RIVER AT PORT SYDNEY,45.21286,-79.27528,ON,UTC-05:00,4000179
02EB008,SOUTH BRANCH MUSKOKA RIVER AT BAYSVILLE,45.14797,-79.1135,ON,UTC-05:00,4000180
02EB011,MOON RIVER AT HIGHWAY NO. 400,45.06506,-79.79014,ON,UTC-05:00,4000181
02EB012,MUSQUASH RIVER AT HIGHWAY NO. 400,45.02253,-79.77681,ON,UTC-05:00,4000182
02EB013,BIG EAST RIVER NEAR HUNTSVILLE,45.39272,-79.15994,ON,UTC-05:00,4000183
02EB014,OXTONGUE RIVER NEAR DWIGHT,45.31197,-78.98939,ON,UTC-05:00,4000184
02EB015,BALA BAY AT BALA,45.01314,-79.61353,ON,UTC-05:00,4000185
02EB016,FAIRY LAKE AT HUNTSVILLE,45.3242,-79.21194,ON,UTC-05:00,4000186
02EB017,KAWAGAMA LAKE AT RUSSELL LANDING,45.26365,-78.8145,ON,UTC-05:00,4000187
02EB018,LAKE MUSKOKA AT BEAUMARIS,45.07042,-79.49383,ON,UTC-05:00,4000188
02EB019,LAKE OF BAYS AT BAYSVILLE,45.14881,-79.11328,ON,UTC-05:00,4000189
02EB020,LAKE ROSSEAU AT PORT CARLING,45.12008,-79.5765,ON,UTC-05:00,4000190
02EB021,MARY LAKE AT PORT SYDNEY,45.21986,-79.27639,ON,UTC-05:00,4000191
02EB022,SMOKE LAKE AT ALGONQUIN PROVINCIAL PARK,45.54156,-78.69539,ON,UTC-05:00,4000192
02EB023,GO HOME LAKE NEAR POTTERS LANDING,44.98611,-79.82858,ON,UTC-05:00,4000193
02EC002,BLACK RIVER NEAR WASHAGO,44.71367,-79.28161,ON,UTC-05:00,4000194
02EC008,BLACK RIVER AT BALDWIN,44.26064,-79.34389,ON,UTC-05:00,4000195
02EC009,HOLLAND RIVER EAST BRANCH AT HOLLAND LANDING,44.09492,-79.48956,ON,UTC-05:00,4000196
02EC010,SCHOMBERG RIVER NEAR SCHOMBERG,44.01214,-79.68564,ON,UTC-05:00,4000197
02EC011,BEAVER RIVER NEAR BEAVERTON,44.39708,-79.07083,ON,UTC-05:00,4000198
02EC014,SEVERN RIVER ABOVE WASDELL FALLS,44.77531,-79.29714,ON,UTC-05:00,4000199
02EC018,PEFFERLAW BROOK NEAR UDORA,44.26753,-79.19461,ON,UTC-05:00,4000200
02EC019,BLACK RIVER NEAR VANKOUGHNET,44.99256,-79.04956,ON,UTC-05:00,4000201
02EC020,HAWKESTONE CREEK AT HAWKESTONE,44.49697,-79.46797,ON,UTC-05:00,4000202
02EC021,UXBRIDGE BROOK NEAR UXBRIDGE,44.13808,-79.11276,ON,UTC-05:00,4000203
02EC022,HEAD RIVER NEAR SEBRIGHT,44.72561,-79.07044,ON,UTC-05:00,4000204
02EC023,SEVERN RIVER NEAR MILL ISLAND,44.752,-79.33181,ON,UTC-05:00,4000205
02ED003,NOTTAWASAGA RIVER NEAR BAXTER,44.24981,-79.82142,ON,UTC-05:00,4000206
02ED007,COLDWATER RIVER AT COLDWATER,44.70719,-79.64375,ON,UTC-05:00,4000207
02ED013,WYE RIVER NEAR WYEVALE,44.64978,-79.90375,ON,UTC-05:00,4000208
02ED014,PINE RIVER NEAR EVERETT,44.20003,-79.96,ON,UTC-05:00,4000209
02ED015,MAD RIVER AT AVENING,44.30736,-80.07203,ON,UTC-05:00,4000210
02ED017,HOGG CREEK NEAR VICTORIA HARBOUR,44.72606,-79.77897,ON,UTC-05:00,4000211
02ED024,NORTH RIVER AT THE FALLS,44.76767,-79.57828,ON,UTC-05:00,4000212
02ED026,NOTTAWASAGA RIVER AT HOCKLEY,44.02475,-79.96989,ON,UTC-05:00,4000213
02ED027,NOTTAWASAGA RIVER NEAR EDENVALE,44.485,-79.966,ON,UTC-05:00,4000214
02ED029,INNISFIL CREEK NEAR ALLISTON,44.13122,-79.78097,ON,UTC-05:00,4000215
02ED030,SILVER CREEK AT ORILLIA,44.64681,-79.45203,ON,UTC-05:00,4000216
02ED031,PRETTY RIVER AT COLLINGWOOD,44.50006,-80.19872,ON,UTC-05:00,4000217
02ED032,WILLOW CREEK NEAR MINESING,44.4425,-79.7995,ON,UTC-05:00,4000218
02ED100,BEETON CREEK NEAR TOTTENHAM,44.04914,-79.80339,ON,UTC-05:00,4000219
02ED101,NOTTAWASAGA RIVER NEAR ALLISTON,44.11058,-79.89028,ON,UTC-05:00,4000220
02FA001,SAUBLE RIVER AT SAUBLE FALLS,44.67753,-81.25606,ON,UTC-05:00,4000221
02FA002,STOKES RIVER NEAR FERNDALE,45.03697,-81.33636,ON,UTC-05:00,4000222
02FA004,SAUBLE RIVER AT ALLENFORD,44.53553,-81.17769,ON,UTC-05:00,4000223
02FB007,SYDENHAM RIVER NEAR OWEN SOUND,44.52225,-80.93019,ON,UTC-05:00,4000224
02FB009,BEAVER RIVER NEAR CLARKSBURG,44.51986,-80.46778,ON,UTC-05:00,4000225
02FB010,BIGHEAD RIVER NEAR MEAFORD,44.57017,-80.6485,ON,UTC-05:00,4000226
02FB012,MILL CREEK NEAR RED WING,44.46423,-80.48576,ON,UTC-05:00,4000227
02FB013,BEAVER RIVER NEAR VANDELEUR,44.34614,-80.53997,ON,UTC-05:00,4000228
02FB014,BIGHEAD RIVER NEAR STRATHAVON,44.47178,-80.77653,ON,UTC-05:00,4000229
02FC001,SAUGEEN RIVER NEAR PORT ELGIN,44.45647,-81.32644,ON,UTC-05:00,4000230
02FC002,SAUGEEN RIVER NEAR WALKERTON,44.12047,-81.11533,ON,UTC-05:00,4000231
02FC011,CARRICK CREEK NEAR CARLSRUHE,44.11339,-81.01925,ON,UTC-05:00,4000232
02FC012,SOUTH SAUGEEN RIVER NEAR HANOVER,44.09869,-80.98456,ON,UTC-05:00,4000233
02FC015,TEESWATER RIVER NEAR PAISLEY,44.26831,-81.26919,ON,UTC-05:00,4000234
02FC016,SAUGEEN RIVER ABOVE DURHAM,44.18542,-80.78747,ON,UTC-05:00,4000235
02FC017,BEATTY SAUGEEN RIVER NEAR HOLSTEIN,44.09047,-80.74194,ON,UTC-05:00,4000236
02FC020,TEESWATER RIVER AT TEESWATER,44.00061,-81.28381,ON,UTC-05:00,4000237
02FC021,CAMP CREEK AT ALLAN PARK,44.16106,-80.92911,ON,UTC-05:00,4000238
02FD002,LUCKNOW RIVER AT LUCKNOW,43.96528,-81.51344,ON,UTC-05:00,4000239
02FD003,NORTH PENETANGORE RIVER AT KINCARDINE,44.17281,-81.63106,ON,UTC-05:00,4000240
02FE002,MAITLAND RIVER BELOW WINGHAM,43.88675,-81.32644,ON,UTC-05:00,4000241
02FE003,MIDDLE MAITLAND RIVER NEAR LISTOWEL,43.72723,-80.97267,ON,UTC-05:00,4000242
02FE005,MAITLAND RIVER ABOVE WINGHAM,43.91508,-81.26439,ON,UTC-05:00,4000243
02FE007,LITTLE MAITLAND RIVER AT BLUEVALE,43.85439,-81.2505,ON,UTC-05:00,4000244
02FE008,MIDDLE MAITLAND RIVER NEAR BELGRAVE,43.81289,-81.30689,ON,UTC-05:00,4000245
02FE009,SOUTH MAITLAND RIVER AT SUMMERHILL,43.68436,-81.54117,ON,UTC-05:00,4000246
02FE010,BOYLE DRAIN NEAR ATWOOD,43.67634,-81.07485,ON,UTC-05:00,4000247
02FE011,MAITLAND RIVER NEAR HARRISTON,43.90381,-80.89261,ON,UTC-05:00,4000248
02FE013,MIDDLE MAITLAND RIVER ABOVE ETHEL,43.71839,-81.12464,ON,UTC-05:00,4000249
02FE014,BLYTH BROOK BELOW BLYTH,43.76033,-81.46319,ON,UTC-05:00,4000250
02FE015,MAITLAND RIVER AT BENMILLER,43.71756,-81.62619,ON,UTC-05:00,4000251
02FE016,SOUTH MAITLAND RIVER AT ROXBORO,43.57925,-81.40131,ON,UTC-05:00,4000252
02FE017,LAKELET CREEK NEAR GORRIE,43.89292,-81.06328,ON,UTC-05:00,4000253
02FF002,AUSABLE RIVER NEAR SPRINGBANK,43.07192,-81.65975,ON,UTC-05:00,4000254
02FF004,SOUTH PARKHILL CREEK NEAR PARKHILL,43.16075,-81.73183,ON,UTC-05:00,4000255
02FF007,BAYFIELD RIVER NEAR VARNA,43.55125,-81.58953,ON,UTC-05:00,4000256
02FF008,PARKHILL CREEK ABOVE PARKHILL RESERVOIR,43.16413,-81.631511,ON,UTC-05:00,4000257
02FF009,AUSABLE RIVER NEAR EXETER,43.36197,-81.50944,ON,UTC-05:00,4000258
02FF010,AUSABLE RIVER NEAR PARKHILL,43.19339,-81.8145,ON,UTC-05:00,4000259
02FF011,SILVER CREEK AT SEAFORTH,43.54536,-81.39636,ON,UTC-05:00,4000260
02FF012,PERCH CREEK AT SARNIA,42.98408,-82.31875,ON,UTC-05:00,4000261
02FF013,LITTLE AUSABLE RIVER NEAR LUCAN CROSSING,43.18056,-81.44767,ON,UTC-05:00,4000262
02FF014,BLACK CREEK NEAR HENSALL,43.41883,-81.49547,ON,UTC-05:00,4000263
02FF015,TRICKS CREEK NEAR CLINTON,43.59031,-81.58411,ON,UTC-05:00,4000264
02GA003,GRAND RIVER AT GALT,43.35311,-80.31575,ON,UTC-05:00,4000265
02GA005,IRVINE RIVER NEAR SALEM,43.6936,-80.44531,ON,UTC-05:00,4000266
02GA006,CONESTOGO RIVER AT ST. JACOBS,43.54111,-80.55333,ON,UTC-05:00,4000267
02GA010,NITH RIVER NEAR CANNING,43.18972,-80.45503,ON,UTC-05:00,4000268
02GA014,GRAND RIVER NEAR MARSVILLE,43.86172,-80.27222,ON,UTC-05:00,4000269
02GA015,SPEED RIVER BELOW GUELPH,43.53372,-80.25222,ON,UTC-05:00,4000270
02GA016,GRAND RIVER BELOW SHAND DAM,43.73094,-80.34094,ON,UTC-05:00,4000271
02GA018,NITH RIVER AT NEW HAMBURG,43.37722,-80.71081,ON,UTC-05:00,4000272
02GA023,CANAGAGIGUE CREEK NEAR ELMIRA,43.57992,-80.50919,ON,UTC-05:00,4000273
02GA024,LAUREL CREEK AT WATERLOO,43.47192,-80.51427,ON,UTC-05:00,4000274
02GA028,CONESTOGO RIVER AT GLEN ALLAN,43.65483,-80.70217,ON,UTC-05:00,4000275
02GA029,ERAMOSA RIVER ABOVE GUELPH,43.54778,-80.18203,ON,UTC-05:00,4000276
02GA030,ALDER CREEK NEAR NEW DUNDEE,43.37229,-80.55109,ON,UTC-05:00,4000277
02GA031,BLUE SPRINGS CREEK NEAR EDEN MILLS,43.57614,-80.109,ON,UTC-05:00,4000278
02GA034,GRAND RIVER AT WEST MONTROSE,43.58503,-80.48147,ON,UTC-05:00,4000279
02GA038,NITH RIVER ABOVE NITHBURG,43.48389,-80.835,ON,UTC-05:00,4000280
02GA040,SPEED RIVER NEAR ARMSTRONG MILLS,43.63861,-80.27,ON,UTC-05:00,4000281
02GA041,GRAND RIVER NEAR DUNDALK,44.14003,-80.3627,ON,UTC-05:00,4000282
02GA043,HUNSBURGER CREEK NEAR WILMOT CENTRE,43.36447,-80.63261,ON,UTC-05:00,4000283
02GA047,SPEED RIVER AT CAMBRIDGE,43.42186,-80.33275,ON,UTC-05:00,4000284
02GA048,GRAND RIVER NEAR DOON,43.41281,-80.41703,ON,UTC-05:00,4000285
02GB001,GRAND RIVER AT BRANTFORD,43.13272,-80.26731,ON,UTC-05:00,4000286
02GB006,HORNER CREEK NEAR PRINCETON,43.17394,-80.55264,ON,UTC-05:00,4000287
02GB007,FAIRCHILD CREEK NEAR BRANTFORD,43.14739,-80.15461,ON,UTC-05:00,4000288
02GB008,WHITEMANS CREEK NEAR MOUNT VERNON,43.12625,-80.38372,ON,UTC-05:00,4000289
02GB010,MCKENZIE CREEK NEAR CALEDONIA,43.03394,-79.94981,ON,UTC-05:00,4000290
02GC002,KETTLE CREEK AT ST. THOMAS,42.77769,-81.214,ON,UTC-05:00,4000291
02GC006,BIG CREEK NEAR DELHI,42.83772,-80.50989,ON,UTC-05:00,4000292
02GC007,BIG CREEK NEAR WALSINGHAM,42.68561,-80.53847,ON,UTC-05:00,4000293
02GC010,BIG OTTER CREEK AT TILLSONBURG,42.85731,-80.72358,ON,UTC-05:00,4000294
02GC011,BIG CREEK NEAR KELVIN,42.98681,-80.44469,ON,UTC-05:00,4000295
02GC014,YOUNG CREEK NEAR VITTORIA,42.76575,-80.29458,ON,UTC-05:00,4000296
02GC017,BIG OTTER CREEK ABOVE OTTERVILLE,42.96583,-80.54258,ON,UTC-05:00,4000297
02GC018,CATFISH CREEK NEAR SPARTA,42.74608,-81.05694,ON,UTC-05:00,4000298
02GC021,VENISON CREEK NEAR WALSINGHAM,42.65336,-80.54844,ON,UTC-05:00,4000299
02GC022,NANTICOKE CREEK AT NANTICOKE,42.80992,-80.07617,ON,UTC-05:00,4000300
02GC026,BIG OTTER CREEK NEAR CALTON,42.71067,-80.84081,ON,UTC-05:00,4000301
02GC029,KETTLE CREEK ABOVE ST. THOMAS,42.83519,-81.13472,ON,UTC-05:00,4000302
02GC030,CATFISH CREEK AT AYLMER,42.77375,-80.98267,ON,UTC-05:00,4000303
02GC031,DODD CREEK BELOW PAYNES MILLS,42.78739,-81.2675,ON,UTC-05:00,4000304
02GC036,SILVER CREEK NEAR GROVESEND,42.67583,-80.95333,ON,UTC-05:00,4000305
02GD001,THAMES RIVER NEAR EALING,42.97356,-81.20858,ON,UTC-05:00,4000306
02GD003,NORTH THAMES RIVER BELOW FANSHAWE DAM,43.04078,-81.18283,ON,UTC-05:00,4000307
02GD004,MIDDLE THAMES RIVER AT THAMESFORD,43.05911,-80.99486,ON,UTC-05:00,4000308
02GD005,NORTH THAMES RIVER AT ST. MARYS,43.25575,-81.14562,ON,UTC-05:00,4000309
02GD008,MEDWAY RIVER AT LONDON,43.01367,-81.28044,ON,UTC-05:00,4000310
02GD009,TROUT CREEK NEAR ST. MARYS,43.27322,-81.10322,ON,UTC-05:00,4000311
02GD010,FISH CREEK NEAR PROSPECT HILL,43.22047,-81.23681,ON,UTC-05:00,4000312
02GD011,CEDAR CREEK AT WOODSTOCK,43.122,-80.75153,ON,UTC-05:00,4000313
02GD014,NORTH THAMES RIVER NEAR MITCHELL,43.45042,-81.20678,ON,UTC-05:00,4000314
02GD015,NORTH THAMES RIVER NEAR THORNDALE,43.14931,-81.19214,ON,UTC-05:00,4000315
02GD016,THAMES RIVER AT INGERSOLL,43.04128,-80.88617,ON,UTC-05:00,4000316
02GD018,AVON RIVER BELOW STRATFORD,43.34472,-81.11642,ON,UTC-05:00,4000317
02GD019,TROUT CREEK NEAR FAIRVIEW,43.29558,-80.97303,ON,UTC-05:00,4000318
02GD021,THAMES RIVER AT INNERKIP,43.21531,-80.69186,ON,UTC-05:00,4000319
02GD027,REYNOLDS CREEK NEAR PUTNAM,42.98156,-80.95461,ON,UTC-05:00,4000320
02GD028,STONEY CREEK AT LONDON,43.022,-81.25344,ON,UTC-05:00,4000321
02GE002,THAMES RIVER AT BYRON,42.9625,-81.33178,ON,UTC-05:00,4000322
02GE003,THAMES RIVER AT THAMESVILLE,42.54486,-81.96727,ON,UTC-05:00,4000323
02GE004,THAMES RIVER AT CHATHAM,42.41428,-82.17944,ON,UTC-05:00,4000324
02GE005,DINGMAN CREEK BELOW LAMBETH,42.93411,-81.35131,ON,UTC-05:00,4000325
02GE006,THAMES RIVER NEAR DUTTON,42.73069,-81.57747,ON,UTC-05:00,4000326
02GE007,MCGREGOR CREEK NEAR CHATHAM,42.3835,-82.09506,ON,UTC-05:00,4000327
02GE008,OXBOW CREEK NEAR KILWORTH,42.966,-81.41803,ON,UTC-05:00,4000328
02GG002,SYDENHAM RIVER NEAR ALVINSTON,42.83081,-81.85172,ON,UTC-05:00,4000329
